chinese,english,source,refs_list
参议院怎能接纳 一位毫无经验的成员... 一位不能自欺欺人... 没能力指导他人的成员？,"What would the Senate do with me, an inexperienced legislator who lacks self-deception, which is essential when seeking to guide others?",JSON,"['What would the Senate do with me, an inexperienced legislator who lacks self-deception, which is essential when seeking to guide others?']"
新版本以广泛的政治共识为基础，对宪法的文字和实质都进行了修正和更新，旨在全面反映成文和不成文的宪法法律并突出表述国家的特征。,"Based on a broad political consensus, the new version amended the wording and updated the substance of the Constitution, with the aims of furnishing a complete picture of written and unwritten constitutional law and highlighting the characteristic elements of the State.",JSON,"['Based on a broad political consensus, the new version amended the wording and updated the substance of the Constitution, with the aims of furnishing a complete picture of written and unwritten constitutional law and highlighting the characteristic elements of the State.']"
没错，但你从来没有,"YEAH,BUTYOUNEVERDID",JSON,"['YEAH,BUTYOUNEVERDID']"
在医学和兽医科学方面，诊断法、免疫和其他生物制药的研制，增强了对一些直至近期还被认为无法抑制的疾病实行管理的能力。,"In medical and veterinary sciences, the development of diagnostics, vaccines and other biopharmaceuticals is broadening the ability to manage diseases that were until very recently considered as incurable.",JSON,"['In medical and veterinary sciences, the development of diagnostics, vaccines and other biopharmaceuticals is broadening the ability to manage diseases that were until very recently considered as incurable.']"
如果安理会选择这一备选办法，又假如双方不愿意或不能在2002年11月1日前达成划分领土协议，在这之后还将要求个人特使向双方出示一份领土划分提案，并将它提交安理会。,"Were the Council to choose this option, in the event that the parties were unwilling or unable to agree upon a division of the Territory by 1 November 2002, the Personal Envoy would also be asked thereafter to show the parties a proposal for division of the Territory that would also be presented to the Council.",JSON,"['Were the Council to choose this option, in the event that the parties were unwilling or unable to agree upon a division of the Territory by 1 November 2002, the Personal Envoy would also be asked thereafter to show the parties a proposal for division of the Territory that would also be presented to the Council.']"
你好，是的，我打电话 查看 如果处方 是为购买... ... ethembutol,"Hi, yes, I'm calling to see if a prescription was purchased for ethembutol?",JSON,"[""Hi, yes, I'm calling to see if a prescription was purchased for ethembutol?""]"
这种做法目前可能还可行，但我们需要考虑到这种形势，不一定改变做法，但至少要对之进行某些调整。,"The approach may be working at this time, but we have to take the situation into consideration, and not necessarily change the approach, but at least perhaps make some adjustments to it.",JSON,"['The approach may be working at this time, but we have to take the situation into consideration, and not necessarily change the approach, but at least perhaps make some adjustments to it.']"
该战略认识到有必要继续保护知识产权并使用《关于与贸易有关的知识产权方面的协定》中的保障措施来保护公众健康。,This strategy recognizes the need for continued protection of intellectual property rights and use of safeguards in the Agreement on Trade-Related Aspects of Intellectual Property Rights (TRIPS) to protect public health.,JSON,['This strategy recognizes the need for continued protection of intellectual property rights and use of safeguards in the Agreement on Trade-Related Aspects of Intellectual Property Rights (TRIPS) to protect public health.']
7. 履行机构鼓励非附件一缔约方在完成当前国家信息通报之前提交资助其后续国家信息通报的项目建议，以避免项目供资失去连续性。,"The SBI encouraged non-Annex I Parties to submit project proposals for the funding of their subsequent national communications before completion of their current national communications, in order to avoid a lack of continuity in project financing.",JSON,"['The SBI encouraged non-Annex I Parties to submit project proposals for the funding of their subsequent national communications before completion of their current national communications, in order to avoid a lack of continuity in project financing.']"
看看，多么整齐洁白啊,Look. Look how straight and white.,JSON,['Look. Look how straight and white.']
我们有优格 果汁 啤酒 要啤酒吗,"We have drinking-yoghurt, juice, beer.",JSON,"['We have drinking-yoghurt, juice, beer.']"
但是 如果你想判断 两个人之间是否有亲缘关系 你肯定不会去看他们有多不同,"And you all know that if you are going to determine whether you're related to your brother or your sister, you can't do it by looking at differences.",JSON,"[""And you all know that if you are going to determine whether you're related to your brother or your sister, you can't do it by looking at differences.""]"
2007年10月4日 第48次全体会议,48th plenary meeting 4 October 2007,JSON,['48th\xa0plenary meeting 4\xa0October 2007']
审议了2000年7月22日马尔代夫总统给经济及社会理事会的信，4,"Having considered the letter dated 22 July 2000 from the President of the Maldives addressed to the President of the Economic and Social Council,",JSON,"['Having considered the letter dated 22 July 2000 from the President of the Maldives addressed to the President of the Economic and Social Council,']"
鉴于这些理由，破产法最好指明对撤销交易至关重要的特殊特点，而不是依赖“欺诈性”或“特惠性”等含义广泛的标签。,"For these reasons, it is desirable that an insolvency laws specify the particular characteristics that are essential for avoidance of transactions, rather than relying on broader labels, such as “fraudulent” or “preferential”.",JSON,"['For these reasons, it is desirable that an insolvency laws specify the particular characteristics that are essential for avoidance of transactions, rather than relying on broader labels, such as “fraudulent” or “preferential”.']"
搜捕事件后，一名被怀疑的招待被雇主杀害。,A waiter suspected to be the informer was killed by the employer after the incident.,JSON,['A waiter suspected to be the informer was killed by the employer after the incident.']
我喜欢粉红色 好像糖果,I like the pink. It's like candy.,JSON,"[""I like the pink. It's like candy.""]"
我的宝贝爱我，她总让我心情好,"My baby loves me, she always makes me feel fine.",JSON,"['My baby loves me, she always makes me feel fine.']"
用以证实索赔人对有关企业的使用所有权的“许可证租赁”协议未注明日期，看来是新的。,The “rent-a-permit” agreement provided to establish the claimant's beneficial ownership of the business is undated and appears to be new.,JSON,"[""The “rent-a-permit” agreement provided to establish the claimant's beneficial ownership of the business is undated and appears to be new.""]"
我也可以带来让你们检验 很好,-I can bring those in as well. -Great.,JSON,['-I can bring those in as well. -Great.']
在一些国家，排外情绪导致了限制性和不公正的政策，无法对现行问题及其根源提供解决办法，使问题更趋恶化。,"In some countries, this exodus has met with restrictive and unfair policies based on xenophobic concepts that, instead of providing a solution to the existing problem and to its root causes, make it even worse.",JSON,"['In some countries, this exodus has met with restrictive and unfair policies based on xenophobic concepts that, instead of providing a solution to the existing problem and to its root causes, make it even worse.']"
-我不是贪心 我爱上你了,- l'm not greedy. l'm in love with you.,JSON,"[""- l'm not greedy. l'm in love with you.""]"
最高理事会代表阿拉伯和伊斯兰国家，沉痛哀悼两圣寺护法法赫特·本·阿布德·阿齐兹·萨乌德国王（愿他的灵魂安息）逝世，并就他为加强理事会的工作、不辜负成员国人民的期待并为推动阿拉伯和伊斯兰民族以及国际社会的各项事业所发挥的作用和取得的成就，向他表示敬意。,"The Council expressed sadness and pain at the Arab and Islamic peoples' loss of the Custodian of the Two Holy Mosques, the late King Fahd Bin Abdulaziz Al Saud, along with appreciation for his glorious deeds and great benevolence that strengthened the Council and supported the aspirations of its peoples, and for the role of the departed, may God have mercy upon him, in the service of Arab and Islamic causes and the family of nations.",JSON,"[""The Council expressed sadness and pain at the Arab and Islamic peoples' loss of the Custodian of the Two Holy Mosques, the late King Fahd Bin Abdulaziz Al Saud, along with appreciation for his glorious deeds and great benevolence that strengthened the Council and supported the aspirations of its peoples, and for the role of the departed, may God have mercy upon him, in the service of Arab and Islamic causes and the family of nations.""]"
2. 该部队的任务是帮助安全理事会实现一个总体目标，即维护国际和平与安全。,"The Force is mandated to help the Security Council achieve an overall objective, namely, to maintain international peace and security.",JSON,"['The Force is mandated to help the Security Council achieve an overall objective, namely, to maintain international peace and security.']"
国际指导委员会会议在其声明中请环境规划署执行主任召开政府间会议，以探索各项可选办法，把千年生态系统评估后续工作进程与国际机制磋商进程结合起来，其目的是考虑设立有效的国际科学政策平台。,The statement from that meeting invited the Executive Director of UNEP to convene an intergovernmental meeting to explore the options of merging the Millennium Ecosystem Assessment follow-up process and the mechanism consultative process with the objective of considering the establishment of an efficient international science-policy interface.,JSON,['The statement from that meeting invited the Executive Director of UNEP to convene an intergovernmental meeting to explore the options of merging the Millennium Ecosystem Assessment follow-up process and the mechanism consultative process with the objective of considering the establishment of an efficient international science-policy interface.']
又忆及大会的所有有关决议，包括最近的2004年12月1日第59/33号决议，其中大会宣布以色列没有遵守安全理事会第497 (1981)号决议，并要求以色列撤出被占领的叙利亚戈兰全境，,"Recalling also all relevant General Assembly resolutions, including the latest, resolution 59/33 of 1 December 2004, in which the Assembly declared that Israel had failed to comply with Security Council resolution 497 (1981) and demanded that Israel withdraw from all the occupied Syrian Golan,",JSON,"['Recalling also all relevant General\xa0Assembly resolutions, including the latest, resolution\xa059/33 of 1 December 2004, in which the Assembly declared that Israel had failed to comply with Security Council resolution\xa0497 (1981) and demanded that Israel withdraw from all the occupied Syrian Golan,']"
欢迎特别代表进行的重要工作，并鼓励特别代表与人权委员会的其他特别机制以及联合国其他相关机关、办事处、部门、专门机构和人员在总部和各国加强合作，,"Welcoming the significant work conducted by the Special Representative, and encouraging strengthened cooperation between the Special Representative and other special procedures of the Commission on Human Rights as well as other relevant United Nations bodies, offices, departments and specialized agencies and personnel, both at headquarters and at the country level,",JSON,"['Welcoming the significant work conducted by the Special Representative, and encouraging strengthened cooperation between the Special Representative and other special procedures of the Commission on Human Rights as well as other relevant United Nations bodies, offices, departments and specialized agencies and personnel, both at headquarters and at the country level,']"
甲替硝基苯胺(MNA;PNMA),(a) Complete rotor assemblies:,JSON,['(a) Complete rotor assemblies:']
把你的臭手放在我妈身上!,- Get your damn hands on my mom!,JSON,['- Get your damn hands on my mom!']
行 没问题 谢谢,"- Yeah, sure. - Thanks a lot, man.",JSON,"['- Yeah, sure. - Thanks a lot, man.']"
in just the right light.,in just the right light.,JSON,['in just the right light.']
你俩去看一下,You two go and take a look.,JSON,['You two go and take a look.']
但他再也没回来,But he never come back.,JSON,['But he never come back.']
我的意思是 在准备食物的 范畴之外的用法,"I mean, no, not as a verb. As a verb in other arenas than froodpreparation? - What do you mean?",JSON,"['I mean, no, not as a verb. As a verb in other arenas than froodpreparation? - What do you mean?']"
- 你可能是老师，但绝对不是老太太,"She knew she was dying when she give me this. Strange, sweet girl.",JSON,"['She knew she was dying when she give me this. Strange, sweet girl.']"
我觉得应该端出来了 但是这比你说的早了五分钟,"I think it should come out, but it's five minutes earlier than you said...",JSON,"[""I think it should come out, but it's five minutes earlier than you said...""]"
中止或终止应于通知的60天后生效，除非承包者在此段时间内按照《公约》第十一部分第五节对管理局中止或终止本合同的权利提出异议。,"The suspension or termination shall be effective 60 days after such notice, unless the Contractor within such period disputes the Authority's right to suspend or terminate this contract in accordance with Part XI, section 5, of the Convention.",JSON,"[""The suspension or termination shall be effective 60 days after such notice, unless the Contractor within such period disputes the Authority's right to suspend or terminate this contract in accordance with Part XI, section 5, of the Convention.""]"
该频率管理计划还将确定在406兆赫频带使用的新频道。,The frequency management plan will also identify new channels for use in the 406 MHz band.,JSON,['The frequency management plan will also identify new channels for use in the 406 MHz band.']
我是约翰佛格森,- My name is John Ferguson.,JSON,['- My name is John Ferguson.']
人权高专办应翻译各条约机构作出的主要解释和结论并加以分发。,OHCHR should translate and disseminate major interpretations and conclusions of the treaty bodies.,JSON,['OHCHR should translate and disseminate major interpretations and conclusions of the treaty bodies.']
2008年10月15日，星期三,"Wednesday, 15 October 2008",JSON,"['Wednesday, 15 October 2008']"
半小时后在加油站见,Why don't I meet you guys back at the station in about a half?,JSON,"[""Why don't I meet you guys back at the station in about a half?""]"
第三世界研究所,Third World Institute,JSON,['Third World Institute']
17. 决定，考虑到第61/237号决议规定的2008年和2009年分摊比额表，由会员国按照第61/243号决议修订的等级分摊46 075 167美元，其中包括该特派团2008年8月1日至12月31日期间的维持费41 819 750美元，每月8 363 950美元，以及2008年8月1日至2009年6月30日期间给支助账户和联合国后勤基地的4 255 717美元，每月386 883美元，但以安全理事会决定延长该特派团的任务为前提；,"Decides to apportion among Member States the amount of 46,075,167 dollars, comprising the amount of 41,819,750 dollars for the maintenance of the Mission for the period from 1 August to 31 December 2008 at a monthly rate of 8,363,950 dollars, and the amount of 4,255,717 dollars for the support account and the United Nations Logistics Base for the period from 1 August 2008 to 30 June 2009 at a monthly rate of 386,883 dollars, in accordance with the levels updated in resolution 61/243, and taking into account the scale of assessments for 2008 and 2009, as set out in resolution 61/237, subject to a decision of the Security Council to extend the mandate of the Mission;",JSON,"['Decides to apportion among Member States the amount of 46,075,167 dollars, comprising the amount of 41,819,750 dollars for the maintenance of the Mission for the period from 1\xa0August to 31\xa0December 2008 at a monthly rate of 8,363,950 dollars, and the amount of 4,255,717 dollars for the support account and the United Nations Logistics Base for the period from 1\xa0August 2008 to 30\xa0June\xa02009 at a monthly rate of 386,883 dollars, in accordance with the levels updated in resolution 61/243, and taking into account the scale of assessments for 2008 and 2009, as set out in resolution 61/237, subject to a decision of the Security Council to extend the mandate of the Mission;']"
Sheldon给过我你写的书... Sheldon sent me the books you wrote... 都是什么超我什么本能冲动的鬼话 all that nonsense about superegos and ids.,Sheldon sent me the books you wrote-- all that nonsense about superegos and ids.,JSON,['Sheldon sent me the books you wrote-- all that nonsense about superegos and ids.']
那，媽媽為什麼準備好了四個位子？,"well, then why did mom set the table for four places?",JSON,"['well, then why did mom set the table for four places?']"
我犯了法?,What do you want? Have I done something wrong?,JSON,['What do you want? Have I done something wrong?']
增进和保护人权小组委员会委员和候补委员名单(2006年) 32,List of members and alternates of the Sub-Commission on the Promotion and Protection of Human Rights (2006) 30,JSON,['List of members and alternates of the Sub-Commission on the Promotion and Protection of Human Rights (2006) 30']
你真的爱她吗?,Do you love her? Do you really love her?,JSON,['Do you love her? Do you really love her?']
此外，报告着重讨论技能劳工移动的影响，并分析了技能劳工的移徙水平和特征，及其管理的问题，并提议从“人才外流”转到“人才循环”的一些措施（见下文第三节）。,"In addition, the report focuses on the impact of the movement of skilled labour and analyses the level and characteristics of the migration of skilled labour, the issue of its management and proposed measures for a shift from “brain drain” to “brain circulation” (see sect. III below).",JSON,"['In addition, the report focuses on the impact of the movement of skilled labour and analyses the level and characteristics of the migration of skilled labour, the issue of its management and proposed measures for a shift from “brain drain” to “brain circulation” (see sect. III below).']"
此种参与可以补充――但不能替代――国内公共和私人在基础设施方面的投资。,Such involvement may complement - but cannot replace - domestic public and private investment in infrastructure.,JSON,['Such involvement may complement - but cannot replace - domestic public and private investment in infrastructure.']
- 對不起 （簡寧斯） 亞瑟 去拿個桶過來,"Arthur, go and get a bucket.",JSON,"['Arthur, go and get a bucket.']"
4. 鉴于各方对工作方法表示满意，有代表团表示，目前无需考虑对工作方法进行重大调整，因此这一项目无需再每年正式列入委员会议程。,"Given the satisfactory state of the working methods, the view was expressed that no substantial changes to those methods could be envisaged at present and that, consequently, the item should no longer be formally maintained on the agenda of the Committee each year.",JSON,"['Given the satisfactory state of the working methods, the view was expressed that no substantial changes to those methods could be envisaged at present and that, consequently, the item should no longer be formally maintained on the agenda of the Committee each year.']"
2008年议会听询“努力有效地维持和平和防止冲突——履行我们的承诺”(由各国议会联盟和大会主席办公室共同组织),2008 Parliamentary Hearing on “Towards effective peacekeeping and the prevention of conflict -- Delivering on our commitments” (jointly organized by the Inter-Parliamentary Union and the Office of the President of the General Assembly),JSON,['2008 Parliamentary Hearing on “Towards effective peacekeeping and the prevention of conflict -- Delivering on our commitments” (jointly organized by the Inter-Parliamentary Union and the Office of the President of the General Assembly)']
"对俄国进行的一次访问,在那里他受到了 英国驻俄大使 斯坦福德·克里普斯的欢迎, 使他确信 令人高兴的斯大林是个伟人","A visit to Russia, where he'd been welcomed by Britain's ambassador, Sir Stafford Cripps, had convinced him that the delightful Stalin was a great man.",JSON,"[""A visit to Russia, where he'd been welcomed by Britain's ambassador, Sir Stafford Cripps, had convinced him that the delightful Stalin was a great man.""]"
妇女团体充分参加各级别和平谈判对建立持久和平与安全是至关重要的。,The full representation of women's groups at all levels of peace negotiations is vital to building sustainable peace and security.,JSON,"[""The full representation of women's groups at all levels of peace negotiations is vital to building sustainable peace and security.""]"
在与建制警察派遣国缔结谅解备忘录之前，上述经费包括按照正在谈判的谅解备忘录偿还派遣国政府自我维持费用的估计所需经费。,"Pending conclusion of memorandums of understanding with the formed police-contributing countries, the above provision includes the estimated requirements for the reimbursement of contributing Governments for self-sustainment costs based on draft memorandums of understanding.",JSON,"['Pending conclusion of memorandums of understanding with the formed police-contributing countries, the above provision includes the estimated requirements for the reimbursement of contributing Governments for self-sustainment costs based on draft memorandums of understanding.']"
对后者的援助和保护将会根据聚类方式进行。,Assistance and protection for the latter would be in accordance with the cluster approach.,JSON,['Assistance and protection for the latter would be in accordance with the cluster approach.']
申诉人指出，委员会已经对这一条款本身可能构成对公约第13条的违反表示关切，因为提交申诉的条件可被看作“恫吓潜在的申诉人”。,"The complainant notes that the Committee has already expressed concern that this provision may in itself constitute a violation of article 13 of the Convention, as the conditions for filing a complaint could be seen as “intimidating a potential complainant”.",JSON,"['The complainant notes that the Committee has already expressed concern that this provision may in itself constitute a violation of article 13 of the Convention, as the conditions for filing a complaint could be seen as “intimidating a potential complainant”.']"
俄罗斯代表团认为，二读通过的条款草案较为平衡，充分考虑到了这一领域的国家实践、判例法和法律学说。,"In the view of his delegation, the draft articles adopted on second reading were well balanced and took full account of State practice, case law and legal doctrine in the field.",JSON,"['In the view of his delegation, the draft articles adopted on second reading were well balanced and took full account of State practice, case law and legal doctrine in the field.']"
964. 社会工作局透过提供新的服务，如家务助理和送餐等，向家庭提供旨在协助其照顾体弱长者的特别援助。,"SWI also provides special support for families to assist them in how to take care of old persons in poor health through the establishment of new facilities which provide to the elderly health care and other services, such as household care and meals.",JSON,"['SWI also provides special support for families to assist them in how to take care of old persons in poor health through the establishment of new facilities which provide to the elderly health care and other services, such as household care and meals.']"
拨款金额由地方社会保障机构确定并支付。,The allocations are set and paid by the territorial social security bodies.,JSON,['The allocations are set and paid by the territorial social security bodies.']
你做稯禧太后，我做李歼英,"You'll be the Empress, I'll be the eunuch.",JSON,"[""You'll be the Empress, I'll be the eunuch.""]"
1991年，在主要死亡原因和残疾原因中居第一位的，是心血管系统的疾病（50％），如高血压和冬季性冠心病。,"In 1991, among the first places of leading causes of death and lost years due to disability were the diseases of cardiovascular system (50%), such as hypertension and coronary isocheimal diseases.",JSON,"['In 1991, among the first places of leading causes of death and lost years due to disability were the diseases of cardiovascular system (50%), such as hypertension and coronary isocheimal diseases.']"
