chinese,english,source,refs_list
对于执行谈判双方缔结的条约和解决有关条约的任何争端，这些评注可能证明非常有用，但不准备将它们作为这些条约的附件，因为其案文本身就可构成具有法律约束力的协定。,"The competent authority shall endeavour, if the objection appears to it to be justified and if it is not itself able to arrive at a satis factory solution, to resolve the case by mutual agreement with the competent authority of the other Contracting State, with a view to the avoidance of taxation which is not in accordance with this Convention.",JSON,"['The competent authority shall endeavour, if the objection appears to it to be justified and if it is not itself able to arrive at a satis factory solution, to resolve the case by mutual agreement with the competent authority of the other Contracting State, with a view to the avoidance of taxation which is not in accordance with this Convention.']"
2004年，世界各地应成员国请求共计部署了八个事件应急行动组来应付恐怖主义事件。,"In 2004, eight (8) Incident Response Teams have been deployed worldwide in response to request of member-countries in managing terrorist incidents.",JSON,"['In 2004, eight (8) Incident Response Teams have been deployed worldwide in response to request of member-countries in managing terrorist incidents.']"
表3 “迅速启动”清洁发展机制应急资源,"Takes note of the funding estimates for the Trust Fund for Participation in the UNFCCC Process specified by the Executive Secretary (US$ 3,356,200 for the biennium 2002-2003), and invites Parties to make contributions to this fund (see table 7 below);",JSON,"['Takes note of the funding estimates for the Trust Fund for Participation in the UNFCCC Process specified by the Executive Secretary (US$ 3,356,200 for the biennium 2002-2003), and invites Parties to make contributions to this fund (see table 7 below);']"
我接受你他妈的道歉。,I accept your fucking apology.,JSON,['I accept your fucking apology.']
"我会打电话 他和像，""嘿！""。","I'll call him and be like, ""Hey! "".",JSON,"['I\'ll call him and be like, ""Hey! "".']"
这类方案鼓励使用安全套，因为安全套不仅是一种避孕措施，也是一种预防疾病的手段。,"These programs promote the use of condoms not only as a contraceptive measure, but a prevention method as well.",JSON,"['These programs promote the use of condoms not only as a contraceptive measure, but a prevention method as well.']"
因此，成员们得出结论，非常应该将该办法同现行的参照点脱钩，并研究其他办法，在不减少工作人员福利的条件下修订各项津贴。,"The members therefore concluded that it would be highly desirable to delink the scheme from the current reference point and to examine other approaches to updating the allowances, without eroding staff benefits in the process.",JSON,"['The members therefore concluded that it would be highly desirable to delink the scheme from the current reference point and to examine other approaches to updating the allowances, without eroding staff benefits in the process.']"
家里有老婆， 孩子还流着鼻涕。,To his wife and sniveling brats.,JSON,['To his wife and sniveling brats.']
"ter Schure, A.F.H. and Larsson, P. 2002. Polybrominated diphenyl ethers in precipitation in Southern Sweden (Skåne, Lund). Atmos. Environ. 36: 4015-4022.","ter Schure, A.F.H. and Larsson, P. 2002. Polybrominated diphenyl ethers in precipitation in Southern Sweden (Skåne, Lund). Atmos. Environ.",JSON,"['ter Schure, A.F.H. and Larsson, P. 2002. Polybrominated diphenyl ethers in precipitation in Southern Sweden (Skåne, Lund). Atmos. Environ.']"
相反，尖端研究开创全新工作方式（及未来工作模式），这需要新型的知识和技能广泛散布到社会中并改变产品和服务。例如，它可能实现对自然资源更环保及更高效的利用，或者投资于更适应人类需要也能更好地与人类互动的各项服务。,"Instead, cutting-edge research pioneers new ways of working (and models of future workplaces), which require novel skills and knowledge that will diffuse widely into society and transform production and services. For example, it could lead to more environmentally friendly and resource-efficient uses of natural resources, or to investment in services that are more responsive to human needs and better attuned to human interaction.",JSON,"['Instead, cutting-edge research pioneers new ways of working (and models of future workplaces), which require novel skills and knowledge that will diffuse widely into society and transform production and services. For example, it could lead to more environmentally friendly and resource-efficient uses of natural resources, or to investment in services that are more responsive to human needs and better attuned to human interaction.']"
10. 又认识到需要加强政府将两性平等观念纳入政策和决策中的能力，并鼓励各国政府、包括联合国系统在内的各国际组织、以及其他的利益攸关方通过提供技术援助和财政资源等，协助和支持发展中国家努力将两性平等观念纳入政策制定的所有方面；,"Also recognizes the need to strengthen the capacity of Governments to incorporate a gender perspective in policies and decision-making, and encourages all Governments, international organizations, including the United Nations system, and other relevant stakeholders to assist and support developing countries' efforts in integrating a gender perspective in all aspects of policymaking, including through the provision of technical assistance and financial resources;",JSON,"[""Also recognizes the need to strengthen the capacity of Governments to incorporate a gender perspective in policies and decision-making, and encourages all Governments, international organizations, including the United Nations system, and other relevant stakeholders to assist and support developing countries' efforts in integrating a gender perspective in all aspects of policymaking, including through the provision of technical assistance and financial resources;""]"
5月7日，一名记者问白宫发言人阿里·弗莱舍：“有没有任何证据证明这一点，还是说这是美国的假设？” 弗莱舍回答：“这不是假设。,"On 7 May, when a journalist asked White House spokesman Ari Fleischer: “Is there any proof of this or is this an assumption by the United States?” Fleischer replied: “No, it's not an assumption.",JSON,"[""On 7 May, when a journalist asked White House spokesman Ari Fleischer: “Is there any proof of this or is this an assumption by the United\xa0States?” Fleischer replied: “No, it's not an assumption.""]"
还有，只是恶作剧般地挑起难民的反感,And JGSDA helicopters circle over the heads of the refugees...,JSON,['And JGSDA helicopters circle over the heads of the refugees...']
拍什么？,Why?,JSON,['Why?']
这意味着在外空不存在主权问题。,This implies that there is no sovereignty in space.,JSON,['This implies that there is no sovereignty in space.']
United Nations Treaty Series -Volume 2140 [英、法(双语)],United Nations Treaty Series -Volume 2140 [E F (bilingual)],JSON,['United Nations Treaty Series -Volume 2140 [E F (bilingual)]']
32. 有关的规定是，所有前民德公民在德国统一过程中失去工作(也包括没有重新受到雇用的公务员)，根据他们的年龄，有权得到失业津贴(即使以前没有付过失业保险)，或统一条约中专门实行的过度性老年津贴，或养老金。,The provision was that all citizens of the former GDR who had lost their jobs in the course of the German unification (which includes also public servants who were not,JSON,['The provision was that all citizens of the former GDR who had lost their jobs in the course of the German unification (which includes also public servants who were not']
该委员会正在制订一份少数民族索引，以期采取有利于少数民族的肯定行动。,The Commission is developing a minority index with a view to facilitating affirmative action for minorities.,JSON,['The Commission is developing a minority index with a view to facilitating affirmative action for minorities.']
例如，在过去一年中，联利特派团报告说去年下半年涉嫌性剥削和性虐待的指控大幅度减少。,"During the past year, for example, UNMIL was able to report that allegations of sexual exploitation and abuse had fallen dramatically during the second half of the year.",JSON,"['During the past year, for example, UNMIL was able to report that allegations of sexual exploitation and abuse had fallen dramatically during the second half of the year.']"
6. 感谢那些持续与联合国及各区域和次区域组织合作执行大会第1514(XV)号决议和联合国其他有关决议的联合国系统各专门机构和其他组织，并请联合国系统所有专门机构和其他组织执行这些决议的有关规定；,"Expresses its appreciation to those specialized agencies and other organizations of the United Nations system that have continued to cooperate with the United Nations and the regional and subregional organizations in the implementation of General Assembly resolution 1514 (XV) and other relevant resolutions of the United Nations, and requests all of the specialized agencies and other organizations of the United Nations system to implement the relevant provisions of those resolutions;",JSON,"['Expresses its appreciation to those specialized agencies and other organizations of the United Nations system that have continued to cooperate with the United Nations and the regional and subregional organizations in the implementation of General Assembly resolution 1514 (XV) and other relevant resolutions of the United Nations, and requests all of the specialized agencies and other organizations of the United Nations system to implement the relevant provisions of those resolutions;']"
不 我沒有這樣說 這不是我的意思 我沒有這樣說,"No, I didn't say that. That's not what I meant. I didn't say that.",JSON,"[""No, I didn't say that. That's not what I meant. I didn't say that.""]"
措施之一就是实施保证妇女在领导和决策过程中地位的国家机制。,One of these measures was to enforce a national mechanism which guarantied implication of women in leadership and decision making process.,JSON,['One of these measures was to enforce a national mechanism which guarantied implication of women in leadership and decision making process.']
从苏丹港到达尔富尔的路程大约1 400英里，目前装备平均需要7周时间才能运到。,"The movement of equipment by road from Port Sudan to Darfur, some 1,400 miles, currently takes an average of seven weeks.",JSON,"['The movement of equipment by road from Port Sudan to Darfur, some 1,400 miles, currently takes an average of seven weeks.']"
我向他保证，在他领导会议审议工作中，尼日利亚代表团将给予全力支持和配合。,I assure him of the full support and cooperation of the Nigerian delegation as he leads the deliberations of the session.,JSON,['I assure him of the full support and cooperation of the Nigerian delegation as he leads the deliberations of the session.']
硂碞琌侥撤狾ゑ菲撤狾,"You got another reason, why snowboarding is better than skiing.",JSON,"['You got another reason, why snowboarding is better than skiing.']"
2. 咨询委员会审议ONUB经费的筹措时使用的文件列在本报告末尾。,The documents used by the Advisory Committee in its consideration of the financing of ONUB are listed at the end of the present report.,JSON,['The documents used by the Advisory Committee in its consideration of the financing of ONUB are listed at the end of the present report.']
你喝醉了，爸 对,You're drunk Dad,JSON,"[""You're drunk Dad""]"
例如，没有一个可以探讨关于国际组织责任的实质性规则的机构论坛。,"For example, there was no institutional forum at which substantive rules on the responsibility of international organizations could be addressed.",JSON,"['For example, there was no institutional forum at which substantive rules on the responsibility of international organizations could be addressed.']"
谁说的啊 是谁说的,"Hey, who said that? Who?",JSON,"['Hey, who said that? Who?']"
"嗨,老弟,最近怎么样啊?",Hey there buddy how's it going?,JSON,"[""Hey there buddy how's it going?""]"
不过，在其他情况下的确存在比较明显的胁迫成份，包括威胁生命、健康、财产和生计。,"In other cases, however, a clearer element of coercion, including threats to life, health, property and livelihood, exists.",JSON,"['In other cases, however, a clearer element of coercion, including threats to life, health, property and livelihood, exists.']"
2003年3月以来拨给监督厅的资源只够聘用一名任期到2003年12月31日的短期审计员。,The resources allotted to OIOS since March 2003 had allowed for the recruitment of only one auditor on a short-term basis to 31 December 2003.,JSON,['The resources allotted to OIOS since March 2003 had allowed for the recruitment of only one auditor on a short-term basis to 31 December 2003.']
"统计办公室收集了有关性别、教育、卫生和住房的数据；根据初步统计结果，黑山约有10,500名罗姆人。","The Statistics Office collected data on gender, education, health and housing; according to preliminary results, there are about 10,500 Roma in Montenegro.",JSON,"['The Statistics Office collected data on gender, education, health and housing; according to preliminary results, there are about 10,500 Roma in Montenegro.']"
在这些参数范围之内进行的价格谈判是不允许的，即使由供应商提出也不行。 另外参见网址：http://www.dti.gov. uk/about/procurement/procue8-8.htm。,"Negotiation on price outside these parameters is not permitted, even if offered by suppliers.” See, further, http://www.dti.gov.uk/about/procurement/procue8-8.htm.",JSON,"['Negotiation on price outside these parameters is not permitted, even if offered by suppliers.” See, further, http://www.dti.gov.uk/about/procurement/procue8-8.htm.']"
我想知道霍尔克里先生在这方面是否有新的进展，特别是在科索沃标准实施计划方面。,"I wonder if Mr. Holkeri has an update on that effort, especially concerning the Kosovo Standards Implementation Plan.",JSON,"['I wonder if Mr. Holkeri has an update on that effort, especially concerning the Kosovo Standards Implementation Plan.']"
44. Frommelt先生（列支敦士登）说，尽管列支敦士登支持该决议草案，但由于第18段中的改动，它不能成为提案国。,"Mr. Frommelt (Liechtenstein) said that, while his country had supported the draft resolution, it could not become a sponsor owing to the changes in paragraph 18.",JSON,"['Mr. Frommelt (Liechtenstein) said that, while his country had supported the draft resolution, it could not become a sponsor owing to the changes in paragraph\xa018.']"
我坚信，对攻击联合国人员事件的最有力遏制是会员国迅速执法。 我必须再次吁请会员国严肃地担负起这项责任。,"There is no doubt in my mind that the strongest deterrent to attacks on United Nations personnel is the swift application of justice by Member States, and I must once again call upon those States to take this responsibility seriously.",JSON,"['There is no doubt in my mind that the strongest deterrent to attacks on United Nations personnel is the swift application of justice by Member States, and I must once again call upon those States to take this responsibility seriously.']"
84. 《贸易法委员会担保交易指南》在应收款彻底转让方面采取这种办法的理由主要有：(i)对于同一转让人主要通过登记方式多次转让同一笔应收款的情形需要有一套综合性的优先权规则（可转让票据所代表的应收款除外，占有可转让票据便具有较优先的担保权）；(ii)需要解决担保式转让与彻底转让之间的优先权冲突；(iii)第三方很难确定一项转让是担保式转让、彻底转让还是在应收款上设定担保权的交易。,"The main reasons for the approach of the UNCITRAL Secured Transactions Guide with respect to outright transfers of receivables are: (i) the need to have a comprehensive set of priority rules where there are multiple assignments of the same receivables by the same assignor mainly based on registration (with the exception of receivables embodied in negotiable instruments with respect to which possession gives a superior security right); (ii) the need to address a priority conflict between an assignment by way of security, an outright assignment and the creation of a security right in a receivable; and (iii) the difficulty of third parties to determine whether an assignment is by way of security, an outright assignment or a transaction creating a security right in a receivable.",JSON,"['The main reasons for the approach of the UNCITRAL Secured Transactions Guide with respect to outright transfers of receivables are: (i) the need to have a comprehensive set of priority rules where there are multiple assignments of the same receivables by the same assignor mainly based on registration (with the exception of receivables embodied in negotiable instruments with respect to which possession gives a superior security right); (ii) the need to address a priority conflict between an assignment by way of security, an outright assignment and the creation of a security right in a receivable; and (iii) the difficulty of third parties to determine whether an assignment is by way of security, an outright assignment or a transaction creating a security right in a receivable.']"
这样吧，我送你去车站,"Here's what I'm going to do. I'm going to take you to a bus station,",JSON,"[""Here's what I'm going to do. I'm going to take you to a bus station,""]"
26. 他回顾了秘书长关于执行《关于残疾人的世界行动纲领》：千年发展目标及与联合国关于残疾问题的其他文书的协同作用的报告（A/62/157）已经根据大会第60/131号决议编制。,He recalled that the Secretary-General's report on the Implementation on the World Programme of Action concerning Disabled Persons: the Millennium Development Goals and synergies with other United Nations disability instruments (A/62/157) had been prepared in response to General Assembly resolution 60/131.,JSON,"[""He recalled that the Secretary-General's report on the Implementation on the World Programme of Action concerning Disabled Persons: the Millennium Development Goals and synergies with other United Nations disability instruments (A/62/157) had been prepared in response to General Assembly resolution 60/131.""]"
89. 应当特别提到妇女在土著、当地和农业社区的作用。,"Special mention should be made of the role of women in indigenous, local and farming communities.",JSON,"['Special mention should be made of the role of women in indigenous, local and farming communities.']"
J. 临时议程项目12:技术和经济评估小组及其各技术选择委员会等群体利益申告准则,J. Item 12 of the provisional agenda: Guidelines for disclosure of interest for groups such as the Technology and Economic Assessment Panel and its technical options committees,JSON,['J. Item 12 of the provisional agenda: Guidelines for disclosure of interest for groups such as the Technology and Economic Assessment Panel and its technical options committees']
http://www.icmm.com/. 国际矿业与金属理事会。,http://www.icmm.com/. International Council on Mining and Metals.,JSON,['http://www.icmm.com/. International Council on Mining and Metals.']
D. 缔约国违反义务的可能补救办法,Possible means of remedying violations by States parties of their obligations,JSON,['Possible means of remedying violations by States parties of their obligations']
西萨里奥，不这样做 我的手表！,"Cesario, do not do this on my watch!",JSON,"['Cesario, do not do this on my watch!']"
谢谢你 福瑞克先生 你可以下去了,"Thank you, Mr. Florrick. You may step down.",JSON,"['Thank you, Mr. Florrick. You may step down.']"
这是有关海上石油运输的风险管理情况。,This is the case with management of risks associated with transport of oil by sea.,JSON,['This is the case with management of risks associated with transport of oil by sea.']
- 有一半的东西。,- Hold on. - You only got half your stuff.,JSON,['- Hold on. - You only got half your stuff.']
为寻求借款进行基本建设投资，地方政府应能按照政府和法律规定的准则和规则，有机会进入国家和国际的资本市场。,"For the purpose of borrowing for capital investment, local authorities should, within guidelines and rules established by Governments and the legislation, have access to national and international capital markets.",JSON,"['For the purpose of borrowing for capital investment, local authorities should, within guidelines and rules established by Governments and the legislation, have access to national and international capital markets.']"
在审计过程中，还评估了主任专员所用的会计原则和所作的重大估计，并对财务报表的列报方式作了总体评价。,"An audit also includes assessing the accounting principles used and significant estimates made by the Commissioner-General, as well as evaluating the overall financial statement presentation.",JSON,"['An audit also includes assessing the accounting principles used and significant estimates made by the Commissioner-General, as well as evaluating the overall financial statement presentation.']"
协调人Yoshiaki Ito先生（日本），在议程项目56 (a) (联合国第一个消除贫穷十年(1997-2006)的执行情况）下,"Facilitator, Mr. Yoshiaki Ito (Japan), under agenda item 56 (a) (Implementation of the first United Nations Decade for the Eradication of Poverty (1997-2006))",JSON,"['Facilitator, Mr. Yoshiaki Ito (Japan), under agenda item 56 (a) (Implementation of the first United Nations Decade for the Eradication of Poverty (1997-2006))']"
4. 在《政治宣言》8 中，各国政府同意“定期评估进一步执行《北京行动纲要》的情况，以期在《北京行动纲要》通过十年和《提高妇女地位内罗毕前瞻性战略》通过二十年之后，于2005年召集有关各方酌情评估取得的进展并审议新的倡议。”,"In the political declaration,8 Governments agreed “to assess regularly further implementation of the Beijing Platform for Action with a view to bringing together all parties involved in 2005 to assess progress and consider new initiatives, as appropriate, 10 years after the adoption of the Beijing Platform for Action and twenty years after the adoption of the Nairobi Forward-looking Strategies for the Advancement of Women”.",JSON,"['In the political declaration,8 Governments agreed “to assess regularly further implementation of the Beijing Platform for Action with a view to bringing together all parties involved in 2005 to assess progress and consider new initiatives, as appropriate, 10 years after the adoption of the Beijing Platform for Action and twenty years after the adoption of the Nairobi Forward-looking Strategies for the Advancement of Women”.']"
由（菲律宾）代理常驻代表恩里克·马纳洛先生阁下主持，举行关于议程项目42下的提案草案的非正式协商 [请所有有兴趣的代表团参加。],"Informal consultations on a draft proposal under agenda item 42, chaired by H. E. Mr. Enrique Manalo, Deputy Permanent Representative (Philippines) [All interested delegations are invited to attend. ]",JSON,"['Informal consultations on a draft proposal under agenda item 42, chaired by H. E. Mr. Enrique Manalo, Deputy Permanent Representative (Philippines) [All interested delegations are invited to attend. ]']"
你可以吗 可以了,"You got that? You all right? We're very, very ready!",JSON,"[""You got that? You all right? We're very, very ready!""]"
他建议的文本包含两款，第一款可有两个备选条文。,"He proposed a version containing two paragraphs, the first of which might have two variants.",JSON,"['He proposed a version containing two paragraphs, the first of which might have two variants.']"
关于姓氏问题，西班牙文化居于优势地位，而且妻子保留自己的姓氏。,Hispanic culture prevails in the use of surnames and the wife keeps her surnames.,JSON,['Hispanic culture prevails in the use of surnames and the wife keeps her surnames.']
爸爸会告诉我们 他在哪里。,Daddy's gonna tell us where he is.,JSON,"[""Daddy's gonna tell us where he is.""]"
我们认为，今后的任何议程都需要将第一届裁军特别联大最后文件中所载行动纲领的实施考虑进去，并作为起始前提。,"We believe that any agenda for the future would have to take into account, as the starting premise, implementation of the programme of action contained in the final document of the General Assembly's first special session on disarmament.",JSON,"[""We believe that any agenda for the future would have to take into account, as the starting premise, implementation of the programme of action contained in the final document of the General Assembly's first special session on disarmament.""]"
