chinese,english,source,refs_list
1. 注意到截至2006年4月30日联合国塞拉利昂观察团和联合国塞拉利昂特派团摊款的缴纳情况，包括欠缴摊款42.6百万美元，约占摊款总额的2％，关切地注意到只有83个会员国已足额缴纳摊款，并促请所有其他会员国，尤其是拖欠国，确保缴纳所欠摊款；,"Takes note of the status of contributions to the United Nations Observer Mission in Sierra Leone and the United Nations Mission in Sierra Leone as at 30 April 2006, including the contributions outstanding in the amount of 42.6 million United States dollars, representing some 2 per cent of the total assessed contributions, notes with concern that only eighty-three Member States have paid their assessed contributions in full, and urges all other Member States, in particular those in arrears, to ensure payment of their outstanding assessed contributions;",JSON,"['Takes note of the status of contributions to the United Nations Observer Mission in Sierra Leone and the United Nations Mission in Sierra Leone as at 30\xa0April 2006, including the contributions outstanding in the amount of 42.6 million United States dollars, representing some 2 per cent of the total assessed contributions, notes with concern that only eighty-three Member States have paid their assessed contributions in full, and urges all other Member States, in particular those in arrears, to ensure payment of their outstanding assessed contributions;']"
196. 预处理：对固体需要进行减小体积的预处理。,Pre-treatment: Solids will require size reduction.,JSON,['Pre-treatment: Solids will require size reduction.']
衣服 围太，老板。,"Clothes are too confining, boss.",JSON,"['Clothes are too confining, boss.']"
玻利维亚人民完全同意我们需要为确保公平的进展打下基础。,The Bolivian people fully agree that we need to lay a foundation for ensuring progress with equity.,JSON,['The Bolivian people fully agree that we need to lay a foundation for ensuring progress with equity.']
他有关对各区域委员会的审计的讲话是根据一项假设，即各委员会会进行其本身的审计审查，然后再由其会员国加以审查。,"His remarks about the audit of the regional commissions had been based on the assumption that the commissions would conduct their own reviews of the audit, which would then be examined by their Member States.",JSON,"['His remarks about the audit of the regional commissions had been based on the assumption that the commissions would conduct their own reviews of the audit, which would then be examined by their Member States.']"
但是，按照《指南》，被许可权人（作为所转让应收款的债务人）的权利不受影响，除非《指南》所建议的担保交易法另有规定（见建议117(a)项）。,"However, under the Guide, the rights of a licensee (as a debtor of the assigned receivables) are not affected except as otherwise provided in the secured transactions law recommended in the Guide (see recommendation 117, subparagraph (a)).",JSON,"['However, under the Guide, the rights of a licensee (as a debtor of the assigned receivables) are not affected except as otherwise provided in the secured transactions law recommended in the Guide (see recommendation 117, subparagraph (a)).']"
已用各种方法迎接区域渔业管理组织的改革或现代化挑战：美洲金枪鱼委员会为制定称为《安提瓜公约》的一项新的组织协定（重要规定在美洲金枪鱼委员会的汇总表中用斜体字列明）进行谈判，该公约生效后将取代现有的《美洲金枪鱼委员会公约》。,The challenge of RFMO reform or modernization has been taken up in various ways: IATTC negotiated a new constitutive agreement known as the Antigua Convention (key provisions are shown in italics in the IATTC matrix in the appendix) that will replace the existing IATTC Convention when it comes into force.,JSON,['The challenge of RFMO reform or modernization has been taken up in various ways: IATTC negotiated a new constitutive agreement known as the Antigua Convention (key provisions are shown in italics in the IATTC matrix in the appendix) that will replace the existing IATTC Convention when it comes into force.']
我故意现在打来的,l called now on purpose.,JSON,['l called now on purpose.']
活泼又直接 我最喜欢了,"Ah. Feisty, yeah. I like feisty.",JSON,"['Ah. Feisty, yeah. I like feisty.']"
虽然“罗姆人同等融合到保加利亚社会的框架方案”被认为是一项正面的发展，但遗憾的是它没有得到执行(种族间促进人权基金会)。,"While the Framework Programme for Equal Integration of Roma in Bulgarian Society was viewed as a positive development, its lack of implementation was regretted (Inter-Ethnic Initiative for Human Rights Foundation).",JSON,"['While the Framework Programme for Equal Integration of Roma in Bulgarian Society was viewed as a positive development, its lack of implementation was regretted (Inter-Ethnic Initiative for Human Rights Foundation).']"
"""和厕所一样的臭地方""",What a shithole. What a toilet.,JSON,['What a shithole. What a toilet.']
因此，在考虑数码鸿沟问题时，我们注意到，电话、传真、用户电报和因特网通信在北方很发达——我称北方为联网的国家——而南方在这方面却极为欠缺。,"Thus, in considering the digital gap, we note that telephone, facsimile, telex and Internet communications are most developed in the North — in what I call the connected countries — whereas the South is sorely lacking in that regard.",JSON,"['Thus, in considering the digital gap, we note that telephone, facsimile, telex and Internet communications are most developed in the North — in what I call the connected countries — whereas the South is sorely lacking in that regard.']"
任何重建方案的成功取决于获得资金。,The success of any reconstruction programme depends on getting funds.,JSON,['The success of any reconstruction programme depends on getting funds.']
管理改革及更好的监督可有助于秘书处更好地执行任务，并接受问责。,"Management reform and improved oversight can help the Secretariat to implement mandates better, and hold it accountable for doing so.",JSON,"['Management reform and improved oversight can help the Secretariat to implement mandates better, and hold it accountable for doing so.']"
工发组织各成员可以携手迎接上述挑战，为子孙后代创造一个更好的世界。,"Together, the members of UNIDO could take up those challenges in the interests of a better world for future generations.",JSON,"['Together, the members of UNIDO could take up those challenges in the interests of a better world for future generations.']"
对我们释放所有的魔鬼力量,Unleash all the forces of evil upon us!,JSON,['Unleash all the forces of evil upon us!']
这将确保安全理事会第1397（2002）号决议切实有助于结束目前实地的惨痛境况，促使各方走上和平的道路。,That will ensure that Security Council resolution 1397 (2002) will indeed help end the current tragic situation on the ground and push the parties towards the path of peace.,JSON,['That will ensure that Security Council resolution 1397 (2002) will indeed help end the current tragic situation on the ground and push the parties towards the path of peace.']
"""明天的事""",What more than being in the dark,JSON,['What more than being in the dark']
在这方面，应当特别强调每一个儿童都有权参与家庭、学校、其他机构和机关、一般社会的事务，同时特别注意弱势和少数群体的儿童。,"In this connection, particular emphasis should be placed on the right of every child to participate in the family, at school, within other institutions and bodies, and in society at large, with special attention to vulnerable and minority groups.",JSON,"['In this connection, particular emphasis should be placed on the right of every child to participate in the family, at school, within other institutions and bodies, and in society at large, with special attention to vulnerable and minority groups.']"
伊拉克政府重申要求那些参与这一侵略的国家立即停止这些行为，因为它们没有国际法依据，侵犯了伊拉克主权，并严重危害到其安全与和平，而且直接严重威胁国际和平与安全。,"The Government of Iraq renews its call to the States involved in the aggression to halt these acts forthwith, since they are unsupported by international law, violate the sovereignty of Iraq and pose a grave threat to that country's security and peace, in addition to representing a direct and serious menace to international peace and security.",JSON,"[""The Government of Iraq renews its call to the States involved in the aggression to halt these acts forthwith, since they are unsupported by international law, violate the sovereignty of Iraq and pose a grave threat to that country's security and peace, in addition to representing a direct and serious menace to international peace and security.""]"
消除贫穷及其他发展问题：联合国第一个 消除贫穷十年(1997-2006)的执行情况,Eradication of poverty and other development issues: implementation of the first United Nations Decade for the Eradication of Poverty (1997-2006),JSON,['Eradication of poverty and other development issues: implementation of the first United Nations Decade for the Eradication of Poverty (1997-2006)']
这就是巴勒斯坦人是如何被杀害的，原因不外乎他们是巴勒斯坦人，这证实了以色列占领部队及其定居者手中对巴勒斯坦人民所犯的种族灭绝罪。,"This is how Palestinians are killed for no reason except for their being Palestinians, which affirms the crime of genocide of the Palestinian people at the hands of Israeli occupation forces and their settlers.",JSON,"['This is how Palestinians are killed for no reason except for their being Palestinians, which affirms the crime of genocide of the Palestinian people at the hands of Israeli occupation forces and their settlers.']"
在另一些事例中，伙伴在提出增值税退税要求时，行动缓慢。,"In other instances, partners were tardy in their submission of VAT reimbursement claims.",JSON,"['In other instances, partners were tardy in their submission of VAT reimbursement claims.']"
维修通道也塞不下那么多 Utility channels don't have enough elbow room 人和现金 for men and money.,Utility channels don't have enough elbow room for men and money.,JSON,"[""Utility channels don't have enough elbow room for men and money.""]"
3. Erwa先生（苏丹）说，他的代表团为此撤消向决议草案（A/C.3/54/L.93）提出的修正案文。,Mr. Erwa (Sudan) said that his delegation therefore withdrew the amendments to the draft resolution which it had submitted (A/C.3/54/L.93).,JSON,['Mr. Erwa (Sudan) said that his delegation therefore withdrew the amendments to the draft resolution which it had submitted (A/C.3/54/L.93).']
在金沙萨控制的地区，外交部长说，无论联合国组织驻刚果民主共和国观察团和其他“看钟下班的人”设下什么限制，他们都将发起攻击，同时，不断有人说要把战争继续下去。,"In the area under Kinshasa's control, the Minister for Foreign Affairs has said they will attack without regard for the limitations set by the United Nations Organization mission in the Democratic Republic of the Congo (MONUC) and other “clock-watchers”, while inflammatory statements are being made to continue with the war.",JSON,"[""In the area under Kinshasa's control, the Minister for Foreign Affairs has said they will attack without regard for the limitations set by the United\xa0Nations Organization mission in the Democratic Republic of the Congo (MONUC) and other “clock-watchers”, while inflammatory statements are being made to continue with the war.""]"
它可能向北， 甚至迁移 与scoters。,"It's probably heading north, maybe even migrating with scoters.",JSON,"[""It's probably heading north, maybe even migrating with scoters.""]"
* 以TD/B/49/L.1号文件提交贸易和发展理事会。,∗ Submitted to the Trade and Development Board in document TD/B/49/L.1.,JSON,['∗ Submitted to the Trade and Development Board in document TD/B/49/L.1.']
这类机制可由非洲联盟加以协调。,Such mechanisms could be coordinated by the African Union.,JSON,['Such mechanisms could be coordinated by the African Union.']
3. 另外，还根据2001年12月21日第56/186号决议，向大会第五十七届和第五十八届会议提交了其他报告（A/57/158和Add.1和2及A/58/125），报告载有29个会员国所做的答复，各国提供资料说明在执行该决议方面取得的进展，或者增补了载于前几次报告中的答复。,"Further reports (A/57/158 and Add.1 and 2 and A/58/125) were submitted to the General Assembly at its fifty-seventh and fifty-eighth sessions in response to resolution 56/186 of 21 December 2001, reflecting the responses of 29 Member States providing information on progress made in the implementation of the resolution or updating replies that had appeared in the previous report.",JSON,"['Further reports (A/57/158 and Add.1 and 2 and A/58/125) were submitted to the General Assembly at its fifty-seventh and fifty-eighth sessions in response to resolution 56/186 of 21 December 2001, reflecting the responses of 29 Member States providing information on progress made in the implementation of the resolution or updating replies that had appeared in the previous report.']"
ISBA/14/LTC/2号文件简要介绍了该提议。,The proposal is outlined in document ISBA/14/LTC/2.,JSON,['The proposal is outlined in document ISBA/14/LTC/2.']
C. 战略框架和建设和平基金付款之间的关系,C. Relationship between the strategic framework and the Peacebuilding Fund disbursement,JSON,['C. Relationship between the strategic framework and the Peacebuilding Fund disbursement']
(a) 提出启动申请,(a) Making an application for commencement,JSON,['(a) Making an application for commencement']
第6条更进一步规定，若不遵守该许可证之条件或该法令的规定，或者为了公共卫生、国家安全或联合王国承担的任何国际义务之利益的需要吊销、变更和/暂停该许可证的话，该大臣可以吊销、变更/或暂停该许可证。,"Section 6 further provides for the revocation, variation and/or suspension of the licence by the Secretary of State in cases of non-compliance with a condition of the licence or regulation under the Act or where such revocation, variation and/or suspension is required in the interests of public health, national security or any international obligation of the United Kingdom.",JSON,"['Section 6 further provides for the revocation, variation and/or suspension of the licence by the Secretary of State in cases of non-compliance with a condition of the licence or regulation under the Act or where such revocation, variation and/or suspension is required in the interests of public health, national security or any international obligation of the United Kingdom.']"
Songshaw控股,Songshaw Holdings?,JSON,['Songshaw Holdings?']
76．Khane先生 （委员会秘书）说，阿富汗、黎巴嫩和巴基斯坦已经加入了提案国行列。,"Mr. Khane (Secretary of the Committee) said that Afghanistan, Lebanon and Pakistan had joined the sponsors.",JSON,"['Mr. Khane (Secretary of the Committee) said that Afghanistan, Lebanon and Pakistan had joined the sponsors.']"
卓斌警官 弗兰克,- Lt. Drebin!,JSON,['- Lt. Drebin!']
根据联合国一系列文书、协定和条约，这一进程得以持续。,"This process is sustained in a series of instruments, agreements and treaties of the United Nations.",JSON,"['This process is sustained in a series of instruments, agreements and treaties of the United Nations.']"
tv = 核查年份,tv = year of verification,JSON,['tv = year of verification']
回顾其2000年12月4日第55/92号决议，,"Recalling its resolution 55/92 of 4 December 2000,",JSON,"['Recalling its resolution 55/92 of 4 December 2000,']"
世界银行主管对外事务和联合国事务副行长Ian Goldin博士将发表演讲。,"A presentation will be made by Dr. Ian Goldin, Vice-President for External Affairs and United Nations Affairs, World Bank.",JSON,"['A presentation will be made by Dr. Ian Goldin, Vice-President for External Affairs and United Nations Affairs, World Bank.']"
...我開始了,...and then I start.,JSON,['...and then I start.']
1. 第一组由8名视察员组成，于上午9时离开巴格达的Canal旅馆，前往国营公司AL-Karama下属的Al-Rifah；这是军事工业局下属的一个单位，位于巴格达以西70公里的Amiriya al-Fallouja区。,"A first group, consisting of eight inspectors, left the Canal Hotel in Baghdad at 0900 hours to inspect the Rifah site belonging to the Karamah State Enterprise, an MIC affiliate, located at Amiriyah/Fallujah, 70 km west of Baghdad.",JSON,"['A first group, consisting of eight inspectors, left the Canal Hotel in Baghdad at 0900 hours to inspect the Rifah site belonging to the Karamah State Enterprise, an MIC affiliate, located at Amiriyah/Fallujah, 70 km west of Baghdad.']"
卡尔先生（卡塔尔）（以阿拉伯语发言）：主席先生，我高兴地以卡塔尔国代表团的名义表示我们由衷祝贺你担任第一委员会主席。,"Mr. Al-Khal (Qatar) (spoke in Arabic): On behalf of the delegation of the State of Qatar, I have the pleasure to extend to you, Mr. Chairman, our sincere congratulations on your assumption of the chairmanship of the First Committee.",JSON,"['Mr. Al-Khal (Qatar) (spoke in Arabic): On behalf of the delegation of the State of Qatar, I have the pleasure to extend to you, Mr. Chairman, our sincere congratulations on your assumption of the chairmanship of the First Committee.']"
劳动权。,Right to work.,JSON,['Right to work.']
从联合国离职的工作人员有权领取最多为60天的未用休假日偿金。,"United Nations staff who separate from the Organization are entitled to be paid for any unused vacation days that they have accrued, up to a maximum of 60 days.",JSON,"['United Nations staff who separate from the Organization are entitled to be paid for any unused vacation days that they have accrued, up to a maximum of 60 days.']"
我们的目标是，通过金融行动工作组、货币基金组织、世界银行和类似于金融行动工作组的区域机构共同进行统一的评估，世界各国都将按照金融行动工作组的标准得到评估。,"It is our goal that through a combination of uniform assessments conducted by FA TF, IMF, World Bank, and FA TF-Style Regional Bodies, all countries throughout the world will be assessed against the FATF standards.",JSON,"['It is our goal that through a combination of uniform assessments conducted by FA TF, IMF, World Bank, and FA TF-Style Regional Bodies, all countries throughout the world will be assessed against the FATF standards.']"
这存在着一个阶层的 区别 但... 我们两个都迈出 了 步子,"It may not be the same level, but exceeded the limits.",JSON,"['It may not be the same level, but exceeded the limits.']"
1. 按照企业、工商促进和发展委员会在其第六届会议上提出的要求，2002年11月25日至27日举行了提高运输效率和简化贸易手续以促进发展中国家参加国际贸易：发展中国家应用最新贸易手续简化措施的问题和潜力专家会议。,"In accordance with the request of the Commission on Enterprise, Business Facilitation and Development at its sixth session, the Expert Meeting on Efficient Transport and Trade Facilitation to Improve Participation by Developing Countries in International Trade: Problems and Potential for the Application of Current Trade Facilitation Measures by Developing Countries was held from 25 to 27 November 2002. The issues discussed included the following:",JSON,"['In accordance with the request of the Commission on Enterprise, Business Facilitation and Development at its sixth session, the Expert Meeting on Efficient Transport and Trade Facilitation to Improve Participation by Developing Countries in International Trade: Problems and Potential for the Application of Current Trade Facilitation Measures by Developing Countries was held from 25 to 27\xa0November\xa02002. The issues discussed included the following:']"
所汇报的2008年度生产量和消费量数据的计算列于报告的附件一(a)、一(b)和一(c)。,"The calculated production and consumption data reported for 2008 are presented in annexes I (a), I (b) and I (c) to the present report.",JSON,"['The calculated production and consumption data reported for 2008 are presented in annexes I (a), I (b) and I (c) to the present report.']"
他特别提请注意序言部分第二、三、四、六和九段以及执行部分第2、3、4、9和10段。,"He drew particular attention to the second, third, fourth, sixth and ninth preambular paragraphs, and to paragraphs 2, 3, 4, 9 and 10.",JSON,"['He drew particular attention to the second, third, fourth, sixth and ninth preambular paragraphs, and to paragraphs 2, 3, 4, 9 and 10.']"
"我要你在我的裤子！""","I want you in my pants!""",JSON,"['I want you in my pants!""']"
它是一个法律问题，对这个领域我能说的或能作的贡献很少。,It is a legal issue and I really do not have much to add or contribute in that area.,JSON,['It is a legal issue and I really do not have much to add or contribute in that area.']
看看这些人 怎么样,Look at all these people?,JSON,['Look at all these people?']
1. 上诉分庭可以确认、推翻或修改根据第七十五条作出的赔偿命令。,"The Appeals Chamber may confirm, reverse or amend a reparation order made under article 75.",JSON,"['The Appeals Chamber may confirm, reverse or amend a reparation order made under article 75.']"
㈠ 销售出版物循环基金,(i) Sales publication revolving fund,JSON,['(i) Sales publication revolving fund']
不，他脑子不清楚。,No. He's not thinking straight.,JSON,"[""No. He's not thinking straight.""]"
64. 专家组注意到世界银行和粮农组织目前正在努力使森林产业、非政府组织和其他利害攸关者参与对话，制订和执行可持续森林管理措施，包括森林证明书制度，作为核查成果的手段。,"The expert group noted the ongoing work by the World Bank and FAO to engage the forest products industry, NGOs and other stakeholders in dialogue to develop and implement sustainable forest management practices, including forest certification systems as tools to verify achievements.",JSON,"['The expert group noted the ongoing work by the World Bank and FAO to engage the forest products industry, NGOs and other stakeholders in dialogue to develop and implement sustainable forest management practices, including forest certification systems as tools to verify achievements.']"
"截至2002年6月30日，未缴摊款总额为4 870万美元,减少了7 140万美元。",Total unpaid assessed contributions as at 30 June 2002 amounting to $48.7 million reflect a decrease of $71.4 million.,JSON,['Total unpaid assessed contributions as at 30 June 2002 amounting to $48.7 million reflect a decrease of $71.4 million.']
我得到了一个点火者 如果你想要燃烧那粪。,I got a lighter if you wanna burn that shit.,JSON,['I got a lighter if you wanna burn that shit.']
它坚决认为，这些行动将有助于创造一些条件，成为使得两个机构之间的关系能够良好运作的前提条件。,It strongly believes that these actions will help to create conditions that are prerequisites for making the partnership between the two institutions work.,JSON,['It strongly believes that these actions will help to create conditions that are prerequisites for making the partnership between the two institutions work.']
由于几个原因，风险资本更合适。 第一，风险资本资金提供的是灵活的长期产权资本，它是根据每个企业的独特需要确定的。,"Venture capital is more appropriate for several reasons. First, venture capital funds provide flexible, long-term equity capital which is customized according to the unique needs of each enterprise.",JSON,"['Venture capital is more appropriate for several reasons. First, venture capital funds provide flexible, long-term equity capital which is customized according to the unique needs of each enterprise.']"
(e) 执行部分第19段，将“考虑到上文第3段确认的五项关切领域”等字改为“铭记上文第3段所述五个问题”；,"(e) In operative paragraph 19, the words “to take into account the five concerns” were replaced by the words “to bear in mind the five issues”;",JSON,"['(e) In operative paragraph 19, the words “to take into account the five concerns” were replaced by the words “to bear in mind the five issues”;']"
