chinese,english,source,refs_list
20. 因此，根据《宪法》第22条，与卢森堡天主教总主教府、犹太教、卢森堡改革派新教教会、卢森堡新教教会、卢森堡希腊东正教教会、卢森堡罗马尼亚和塞尔维亚东正教教会以及卢森堡英国圣公会缔结了协议。,"Thus conventions based on article 22 of the Constitution have been concluded with the Roman Catholic Archbishopric of Luxembourg, with the Jewish faith, with the Protestant Reformed Church of Luxembourg, the Protestant Church of Luxembourg, the Hellenic Orthodox Church in Luxembourg, the Romanian and Serbian Orthodox Churches of Luxembourg, and the Anglican Church of Luxembourg.",JSON,"['Thus conventions based on article 22 of the Constitution have been concluded with the Roman Catholic Archbishopric of Luxembourg, with the Jewish faith, with the Protestant Reformed Church of Luxembourg, the Protestant Church of Luxembourg, the Hellenic Orthodox Church in Luxembourg, the Romanian and Serbian Orthodox Churches of Luxembourg, and the Anglican Church of Luxembourg.']"
"根据《政府财政法》(Abgabenordnung,AO)第31 b条，税收部门也有义务报告可疑的交易。","Under Section 31b of the Fiscal Code (Abgabenordnung, AO) the obligation to report suspicious transactions is extended to the revenue authorities.",JSON,"['Under Section 31b of the Fiscal Code (Abgabenordnung, AO) the obligation to report suspicious transactions is extended to the revenue authorities.']"
为此目的，前南问题国际法庭研究了国际法院在1986年尼加拉瓜案中的裁定。,For this purpose it examined the jurisprudence of the International Court of Justice in the Nicaragua case of 1986.,JSON,['For this purpose it examined the jurisprudence of the International Court of Justice in the Nicaragua case of 1986.']
5. 下文各节介绍会议的主要结果。,The following sections describe the key results from the meeting.,JSON,['The following sections describe the key results from the meeting.']
2008年12月12日星期五，下午3:00至6:00，托管厅。,"Friday, 12 December 2008, from 3 to 6 p.m. in the Trusteeship Council Chamber.",JSON,"['Friday, 12 December 2008, from 3 to 6 p.m. in the Trusteeship Council Chamber.']"
结论意见在导言部分应包括与报告或任何其他文件有关的具体资料以及代表团的质量；在“关切事项和建议”一节清楚地把关切事项同建议联系起来，建议的重点是切实可行和尽可能准确的各种提议。,"They should include specific information relating to the report or any other documentation and quality of the delegation in the introduction; include in the “concerns and recommendations” section a clear connection between the concerns and recommendations, with recommendations concentrating on concrete proposals that should be as practical and precise as possible.",JSON,"['They should include specific information relating to the report or any other documentation and quality of the delegation in the introduction; include in the “concerns and recommendations” section a clear connection between the concerns and recommendations, with recommendations concentrating on concrete proposals that should be as practical and precise as possible.']"
该提案提出的修改是：准许自缔约方作出一项决定之日起两年之后使该决定的规定自动开始生效。,The proposal involved modifications to permit automatic entry into force two years after a decision had been taken by the Parties.,JSON,['The proposal involved modifications to permit automatic entry into force two years after a decision had been taken by the Parties.']
有个人下班回家 发现他女朋友正在打包准备走人,"""Today I found out you're a pedophile.""",JSON,"['""Today I found out you\'re a pedophile.""']"
放开我，回去吧,Leave me alone! Go home!,JSON,['Leave me alone! Go home!']
(b) 重申船旗国、港口国和沿海国皆有责任依照国际法特别是《公约》确保有效落实和强制执行有关海事安全与安保的国际法律文书，重申船旗国负有的主要责任需要进一步加强包括通过提高船只所有权的透明度；,"(b) Reaffirm that flag, port and coastal States all bear responsibility for ensuring the effective implementation and enforcement of international instruments relating to maritime security and safety, in accordance with international law, in particular the Convention, and that flag States have primary responsibility that requires further strengthening, including through increased transparency of ownership of vessels;",JSON,"['(b) Reaffirm that flag, port and coastal States all bear responsibility for ensuring the effective implementation and enforcement of international instruments relating to maritime security and safety, in accordance with international law, in particular the Convention, and that flag States have primary responsibility that requires further strengthening, including through increased transparency of ownership of vessels;']"
14. 卢旺达仍然关注的是，专家组对解放卢旺达民主力量表示的自由放任态度不仅不利于专家组的任务也可能损害安全理事会第1493（2003）号决议决定执行的禁运。,"Rwanda remains concerned that the permissive attitude to FDLR exhibited by the Group is not only inimical to the Group's mission, but also has the potential to jeopardize enforcement of the embargo decided on by the Security Council in its resolution 1493 (2003).",JSON,"[""Rwanda remains concerned that the permissive attitude to FDLR exhibited by the Group is not only inimical to the Group's mission, but also has the potential to jeopardize enforcement of the embargo decided on by the Security Council in its resolution 1493 (2003).""]"
㈢ 商业、工业、贸易或专业性质的任何其他合同或交易，但不包括雇用人员的合同。,"(iii) any other contract or transaction of a commercial, industrial, trading or professional nature, but not including a contract of employment of persons.",JSON,"['(iii) any other contract or transaction of a commercial, industrial, trading or professional nature, but not including a contract of employment of persons.']"
由于印度尼西亚坚定地致力于参与解决这场危机，我们派出了一个由850人组成的机械化步兵营，以此作为安全理事会第1701（2006）号决议授权的联合国驻黎巴嫩临时部队（联黎部队）的组成部分。,"Deeply committed to being a part of the solution to this crisis, Indonesia is sending an 850-strong mechanized infantry battalion to form part of the United Nations Interim Force in Lebanon (UNIFIL), as mandated by Security Council resolution 1701 (2006).",JSON,"['Deeply committed to being a part of the solution to this crisis, Indonesia is sending an 850-strong mechanized infantry battalion to form part of the United Nations Interim Force in Lebanon (UNIFIL), as mandated by Security Council resolution 1701 (2006).']"
第三，我们赞赏联合国在调动对新伙伴关系的国际援助方面所发挥的先锋作用。,"Thirdly, we appreciate the pioneering role played by the United Nations in mobilizing international assistance for NEPAD.",JSON,"['Thirdly, we appreciate the pioneering role played by the United Nations in mobilizing international assistance for NEPAD.']"
-我只是来问你...,"This ain't the kind of night, is it. Hey!",JSON,"[""This ain't the kind of night, is it. Hey!""]"
介绍决议草案A/C.3/59/L.15,Introduction of draft resolution A/C.3/59/L.15,JSON,['Introduction of draft resolution A/C.3/59/L.15']
生活环境改善项目可以直接由市长或县长执行，或者由市、县长委托韩国住房建筑总公司来执行。,The Living Environment Improvement projects can be carried out directly by mayors or heads of counties or by the Korea Housing Corporation entrusted by mayors or heads.,JSON,['The Living Environment Improvement projects can be carried out directly by mayors or heads of counties or by the Korea Housing Corporation entrusted by mayors or heads.']
撤回一反对直接涉及的只是反对国和保留国。,“Withdrawal of an objection directly concerned only the objecting State and the reserving State”.,JSON,['“Withdrawal of an objection directly concerned only the objecting State and the reserving State”.']
16. 在自动管理系统投入运行之后，行政当局将审查按季度发出催缴函的可能性。,"Following implementation of the automated system, the Administration will examine the possibility of issuing quarterly reminder letters.",JSON,"['Following implementation of the automated system, the Administration will examine the possibility of issuing quarterly reminder letters.']"
1347. 在青少年健康方面，令委员会关注的是，十几岁女孩怀孕率居高不下且仍在上升，从而使得18岁以下女孩堕胎，特别是非法堕胎的比率极高；性病比率上升，艾滋病毒更加扩散。,"The Committee recommends that the State party increase its efforts in promoting adolescent health policies and counselling services, as well as strengthening reproductive health education, including the promotion of male acceptance of the use of contraceptives.",JSON,"['The Committee recommends that the State party increase its efforts in promoting adolescent health policies and counselling services, as well as strengthening reproductive health education, including the promotion of male acceptance of the use of contraceptives.']"
这场冲突还直接影响到巴西，特别是亚马逊地区，当地政府报告那里有1.7万哥伦比亚人需要保护。,The evolution of the post levels in the Middle East and North Africa from 2005 onwards is summarized in the graph below; details at the country level are provided in Table II.1B.,JSON,['The evolution of the post levels in the Middle East and North Africa from 2005 onwards is summarized in the graph below; details at the country level are provided in Table II.1B.']
计划到2005年初级保健单位达到 2 800个，但报告称现在只有1 626个投入使用，今年能补足短缺吗？,"It had been intended that there would be 2,800 of them by 2005, but the report said that only 1,626 units were currently in operation; would that shortfall be covered by the current year?",JSON,"['It had been intended that there would be 2,800 of them by 2005, but the report said that only 1,626 units were currently in operation; would that shortfall be covered by the current year?']"
27．在接受同艾德先生一起编写关于属于少数群体的人和土著人民两者权利之间的关系和区别的工作文件时，我首先意识到作为本工作文件第一部分的由艾德先生编写的极好而十分全面的文件，也意识到其他一些法律学者和联合国系统主管机构在我之前进行的工作，这些工作讨论了这一主题，或是未能因解决“少数群体”和“土著”这两个词的复杂问题而使各有关政府和群体感到满意。,"In accepting the task to prepare a working paper with Mr. Eide on the relationship and distinction between the rights of persons belonging to minorities and those of indigenous peoples, I am conscious, first of all, of the excellent and very comprehensive paper by Mr. Eide which constitutes Part I of the present working paper and of the work of a number of other legal scholars and competent bodies of the United Nations system that have preceded me and dealt with the subject matter or failed to resolve the complex question of the terms “minorities” and “indigenous” to the satisfaction of Governments and the groups concerned.",JSON,"['In accepting the task to prepare a working paper with Mr. Eide on the relationship and distinction between the rights of persons belonging to minorities and those of indigenous peoples, I am conscious, first of all, of the excellent and very comprehensive paper by Mr.\xa0Eide which constitutes Part I of the present working paper and of the work of a number of other legal scholars and competent bodies of the United Nations system that have preceded me and dealt with the subject matter or failed to resolve the complex question of the terms “minorities” and “indigenous” to the satisfaction of Governments and the groups concerned.']"
她从不回家。,She never went home. Have you seen her?,JSON,['She never went home. Have you seen her?']
数据库旨在记载最近100年来发生的变化，提供有关数据，以分析和了解日本地名历史。,The intent was to capture the changes that had occurred in the past 100 years and to make the data available to allow the analysis and understanding of the geographical names history of Japan.,JSON,['The intent was to capture the changes that had occurred in the past 100 years and to make the data available to allow the analysis and understanding of the geographical names history of Japan.']
你如此美丽 如同天使降临,You look so good to me like living in a fantasy,JSON,['You look so good to me like living in a fantasy']
你丈夫说的... 要是哥伦布没发现美洲，我们现在就都是印第安人了,"And what your husband said... if Columbus had done it, we'd all be Indians.",JSON,"[""And what your husband said... if Columbus had done it, we'd all be Indians.""]"
27. 斯洛文尼亚赞扬了波兰在所有领域开展的艰巨工作和受人瞩目的发展。,Slovenia commended the hard work and impressive developments in the country in all areas.,JSON,['Slovenia commended the hard work and impressive developments in the country in all areas.']
隧道的安全就会有更大保证。,Safety in tunnels will thus be reinforced.,JSON,['Safety in tunnels will thus be reinforced.']
莫桑比克驻葡萄牙特命全权大使（1996年-）。,Ambassador Extraordinary and Plenipotentiary of Mozambique to Portugal (1996- ).,JSON,['Ambassador Extraordinary and Plenipotentiary of Mozambique to Portugal (1996- ).']
全国妇女安全工作组,National Women's Safety Taskforce,JSON,"[""National Women's Safety Taskforce""]"
44. 列支敦士登,CCW/AP.II/CONF.9/NAR.10 The Russian Federation,JSON,['CCW/AP.II/CONF.9/NAR.10 The Russian Federation']
主席还将要求缔约国明确说明，由于缺少或对提出的问题没有作出充分答复，因此无法回答问题，在对话结束时对缔约国可能会提出其他问题，并最终反映在结论意见中。,"The Chairperson will also invite the State party to clearly indicate when a response to a question cannot be provided as lack of, or inadequate replies to questions raised may result in follow-up questions to be put to the State party at the end of the dialogue, and eventually, may be reflected in the concluding comments.",JSON,"['The Chairperson will also invite the State party to clearly indicate when a response to a question cannot be provided as lack of, or inadequate replies to questions raised may result in follow-up questions to be put to the State party at the end of the dialogue, and eventually, may be reflected in the concluding comments.']"
按照第1304（2000）号决议第3段的规定，卢旺达部队和乌干达部队已从基桑加尼撤出，但尚不能确定这些部队是否已被调至冲突其他地方。,"Pursuant to paragraph 3 of resolution 1304 (2000), Rwandan and Ugandan forces have withdrawn from Kisangani, although whether or not they have been redeployed to other areas of confrontation has yet to be ascertained.",JSON,"['Pursuant to paragraph 3 of resolution 1304 (2000), Rwandan and Ugandan forces have withdrawn from Kisangani, although whether or not they have been redeployed to other areas of confrontation has yet to be ascertained.']"
在许多实行登记制度的法域内，这种通知是通过将判决产生的担保权纳入登记系统而提供的。,"In many jurisdictions in which there is a registration system, this notice is provided by subjecting judgement security rights to the registration system.",JSON,"['In many jurisdictions in which there is a registration system, this notice is provided by subjecting judgement security rights to the registration system.']"
(7) 尽管注意到葡萄牙代表团说为查证身份而逮捕是例外情况，但既然可能导致特定场合下的集体逮捕，委员会对缔约国存在这一程序感到遗憾。,"(7) While noting that, according to the Portuguese delegation, arrests for identification purposes are exceptional, the Committee regrets such a procedure exists, since it could lead to group arrests being made under certain circumstances.",JSON,"['(7) While noting that, according to the Portuguese delegation, arrests for identification purposes are exceptional, the Committee regrets such a procedure exists, since it could lead to group arrests being made under certain circumstances.']"
我知道 这样在无聊的时候 我们就可以和朋友聊天,"I know. Then friends could call us, or we could call them when we're bored.",JSON,"[""I know. Then friends could call us, or we could call them when we're bored.""]"
27． 这些中期审查的结论是，国家方案的目标仍然有效，并应得到保持。,The MTR concluded that the objectives of the country programme remain valid and should be maintained.,JSON,['The MTR concluded that the objectives of the country programme remain valid and should be maintained.']
西非分区域小武器的扩散特别让塞拉利昂担心。,The proliferation of small arms in the West African subregion is of special concern to Sierra Leone.,JSON,['The proliferation of small arms in the West African subregion is of special concern to Sierra Leone.']
- 你讨厌我的文章,- You hate my writing.,JSON,['- You hate my writing.']
你和我，夏洛特，五个,"You and I, Charlotte, in five.",JSON,"['You and I, Charlotte, in five.']"
灵感来源非常贴近生活,Inspired by these very surroundings.,JSON,['Inspired by these very surroundings.']
议程项目22(k),Agenda item 22 (k),JSON,['Agenda item 22 (k)']
92. 2001年，男性失业率为8.7%，而女性失业率较上一年增长，增至4.9%。,"In 2001 the male unemployment rate was 8.7 per cent, while the female rate showed an increase over the previous year, rising to 4.9 per cent.",JSON,"['In 2001 the male unemployment rate was 8.7 per cent, while the female rate showed an increase over the previous year, rising to 4.9 per cent.']"
23. 国际人权联盟联合会（人权联会）、人权监察站、国际法学家委员会和国际妇女权利行动观察-亚洲/太平洋（妇女权利观察-亚太）的代表向委员会间会议提出关于加强人权条约机构系统的看法，人权联会、人权检查站和国际法学家委员会并就此事提出一份联合文件，这份文件也得到其它非政府组织的支持。,"Representatives of the International Federation of Human Rights Leagues (FIDH), Human Rights Watch (HRW), the International Commission of Jurists (ICJ) and International Women's Rights Action Watch-Asia Pacific (IWRAW-AP) presented their views to the inter-committee meeting with regard to the strengthening of the human rights treaty body system, with FIDH, HRW and ICJ providing a joint paper on the matter that was also supported by other NGOs.",JSON,"[""Representatives of the International Federation of Human Rights Leagues (FIDH), Human Rights Watch (HRW), the International Commission of Jurists (ICJ) and International Women's Rights Action Watch-Asia Pacific (IWRAW-AP) presented their views to the inter-committee meeting with regard to the strengthening of the human rights treaty body system, with FIDH, HRW and ICJ providing a joint paper on the matter that was also supported by other NGOs.""]"
我是 - -我是记者,"I'm-I'm a journalist, myself.",JSON,"[""I'm-I'm a journalist, myself.""]"
- 保罗？,"-(Carl) Yes, Paul?",JSON,"['-(Carl) Yes, Paul?']"
他现在简直就是一条哈巴狗 你骂他打他 他还多谢你呢,"He's in that overly sweet hangdog stage ... where I could set him on fire, and he'd thank me for it.",JSON,"[""He's in that overly sweet hangdog stage ... where I could set him on fire, and he'd thank me for it.""]"
它的落实要求国家和地方的若干政府部门和机构共同努力，并需要三方伙伴和许多其他利益攸关方深入参与。,Its realization cuts across several Government agencies and institutions at national and local levels and requires the deep engagement of the tripartite partnership and many other stakeholders.,JSON,['Its realization cuts across several Government agencies and institutions at national and local levels and requires the deep engagement of the tripartite partnership and many other stakeholders.']
但你還是不能開我的車,You still can't drive my car.,JSON,"[""You still can't drive my car.""]"
在刚果民盟－戈马派控制的地区，其他矿产资源也要上缴类似的比例。,A similar percentage is applied for other mineral resources in the area controlled by RCD-Goma.,JSON,['A similar percentage is applied for other mineral resources in the area controlled by RCD-Goma.']
45. 表4摘要列示1997-2007年期间由于医疗照射而造成的电离辐射年度集体有效剂量估计值。,Table 4 summarizes the estimated annual collective effective dose of ionizing radiation due to medical exposures for the period 1997-2007.,JSON,['Table 4 summarizes the estimated annual collective effective dose of ionizing radiation due to medical exposures for the period 1997-2007.']
在塞缪尔・马德医治布斯的同时 50公里外的林肯已濒临死亡,"At the same time that Dr. Samuel Mudd is tending to John Wilkes Booth, 50 kilometers away, Abraham Lincoln is dying.",JSON,"['At the same time that Dr. Samuel Mudd is tending to John Wilkes Booth, 50 kilometers away, Abraham Lincoln is dying.']"
而正式文件系统则是所有各种正式语文的定本的电子存放处，而且在那里文件总是同时张贴的。,"The Official Document System (ODS), on the other hand, was the sole electronic repository for the definitive texts in all official languages, which were always posted on it simultaneously.",JSON,"['The Official Document System (ODS), on the other hand, was the sole electronic repository for the definitive texts in all official languages, which were always posted on it simultaneously.']"
不過，我是最糟糕的一個， 我父親曾是大教堂的院長，我母親... 從塞維爾到格雷那達...,"And just because of some - forgive the expression - son of a bitch Surely they can't touch you, believe me!",JSON,"[""And just because of some - forgive the expression - son of a bitch Surely they can't touch you, believe me!""]"
許多天才人物都是這樣,So do several geniuses that I could mention.,JSON,['So do several geniuses that I could mention.']
- 这就是他们是如何这么长时间持续。,- That's how they've lasted so long.,JSON,"[""- That's how they've lasted so long.""]"
会议呼吁必须把危害人类罪的肇事者绳之以法。,It called for the necessity of bringing the perpetrators of these crimes against humanity to trial.,JSON,['It called for the necessity of bringing the perpetrators of these crimes against humanity to trial.']
应指出，联黎部队行动区内至今没有发现任何新的武器。,"It should be noted that, to date, no new weapons have been discovered in the Force's area of operations.",JSON,"[""It should be noted that, to date, no new weapons have been discovered in the Force's area of operations.""]"
但是，如果一个人不具有 本新闻稿中的成功， 你的心被卡住 在稚气的状态。 而且有一个真正的危险 感染的下一代。,"But if an individual doesn't succeed in shaking it off, his mind is stuck in a permanent state of infancy, and there is a real danger that he will infect the next generation.",JSON,"[""But if an individual doesn't succeed in shaking it off, his mind is stuck in a permanent state of infancy, and there is a real danger that he will infect the next generation.""]"
委员会将提供2006年海上声波技术的最新资料。,The Committee will provide an update on marine acoustic technology in 2006.,JSON,['The Committee will provide an update on marine acoustic technology in 2006.']
“22． 对中东和南亚的紧张局势表示关切，并重申支持在中东建立无核武器和其他大规模毁灭性武器区并在南亚建立无核武器区；,“22. Expresses concern at tensions in the Middle East and South Asia and renews support for the establishment of a Middle East zone free of nuclear weapons and other weapons of mass destruction and of a nuclear-weapon-free zone in South Asia;,JSON,['“22. Expresses concern at tensions in the Middle East and South Asia and renews support for the establishment of a Middle East zone free of nuclear weapons and other weapons of mass destruction and of a nuclear-weapon-free zone in South Asia;']
